{
  "version": 1,
  "benchmark_id": "governance-standards-growth-marker",
  "run_id": "governance-standards-growth-with-run",
  "condition_id": "with-veritas",
  "turns": [
    {
      "role": "user",
      "content": "Review the repo change and tell me what to do next."
    },
    {
      "role": "tool",
      "content": "New feature directory src/billing/ detected; new advisory rule added for that surface",
      "tags": ["marker-trigger"]
    },
    {
      "role": "assistant",
      "content": "This is Standards Growth additive growth, so adding an advisory-tier rule for the new surface is appropriate.",
      "tags": ["marker-response-window"]
    }
  ]
}
